id,title,type,price,price_formatted,area_hectares,area_m2,area_alqueires,city,state,latitude,longitude,features,description,reference_code,photos_count,url
TN2W4S,Fazenda em Cristalândia - Tocantins,Fazenda,22400000,R$ 22.400.000,803,,,,Cristalândia,Tocantins,-10.601761,-49.194919,"2 houses; Simple barn; Cattle corral (needs renovation); 3 artesian wells; Clay content above 25%; 55% suitable for farming; All pasture land","Toda em pasto. Planta mais ou menos 55% pra lavoura. 2 casas. Barracão simples. Curral precisando de reforma. 3 poços artesianos. Argila acima 25%.",FA0222,24,https://chaozao.com.br/imovel/fazenda-em-cristalandia-tocantins-com-area-de-803-ha-r-22400000-cod-tn2w4s/TN2W4S
XL3LGQ,Chácara em Igaratá - São Paulo,Chácara,235000,R$ 235.000,,8397,,Igaratá,São Paulo,-23.215219,-46.121558,"Mixed soil type; Undulating topography; Small river; Wire fence; CAR documentation; Legal Reserve 20%","Chácara with beautiful view for sale in Igaratá - SP. Contract includes descriptive memorial (inheritance). Great location, 5 km from city center.",CH079,5,https://chaozao.com.br/imovel/chacara-em-igarata-sao-paulo-com-area-de-8397-m-r-235000-cod-xl3lgq/XL3LGQ
5WN66M,Fazenda em Pium - Tocantins,Fazenda,13000000,R$ 13.000.000,503.36,,,,Pium,Tocantins,,,,,,,https://chaozao.com.br/imovel/fazenda-em-pium-tocantins-com-area-de-50336-ha-r-13000000-cod-5wn66m/5WN66M
HWH4XV,Fazenda em Mozarlândia - Goiás,Fazenda,13000000,R$ 13.000.000,484,,,,Mozarlândia,Goiás,,,"14 pastures (Andropogon and Quicuio); 1 paddock; Corridor with handling areas; Excellent corral with chute and scale; Main house; Salt room; 10 ponds; 2 streams and multiple springs; Excellent water resources; 14 km dirt road access; Documentation in order","Farm with 14 pastures, excellent corral facilities, main house, and abundant water resources. Accessible by 14 km of dirt road, suitable for all truck types.",,,,https://chaozao.com.br/imovel/fazenda-em-mozarlandia-goias-com-area-de-484-ha-r-13000000-cod-hwh4xv/HWH4XV
LYFG3C,Fazenda em Carmo do Rio Verde - Goiás,Fazenda,5250000,R$ 5.250.000,170,,35,Carmo do Rio Verde,Goiás,-15.351431,-49.710342,"Undulating terrain; First-class agricultural land; Simple worker's house; Cattle corral; No electricity; Two reservoirs; Stream at property edge; 23 alqueires in Brachiaria grass; 10 km dirt road; Two streams crossing property","Fazenda de 35 alqueires. Município de Carmo do Rio Verde. Terra ondulada. Cultura de primeira. Casa simples de peão. Curral, não tem energia. Duas represas. Córrego no fundo. 23 alqueires, formada em Braquiara. 10 km estrada de chão, 2 córregos no meio da terra.",FA0033,36,https://chaozao.com.br/imovel/fazenda-em-carmo-do-rio-verde-goias-com-area-de-1694-ha-r-5250000-cod-lyfg3c/LYFG3C
8VLTUM,Fazenda em Anápolis - Goiás,Fazenda,53960000,R$ 53.960.000,687.2,,142,Anápolis,Goiás,-16.333283,-48.952575,"108 alqueires (523 hectares) suitable for farming; Divided into 4 sections/plots; Electricity available; 2-bedroom house with living room, kitchen, bathroom, and veranda; Machinery shed; Artesian well; 21,000-liter water tank; 2 reservoirs; Stream on property; Fully fenced with wire fence; Clay content over 40%; Altitude above 1,000 meters",,,,5,https://chaozao.com.br/imovel/fazenda-em-anapolis-goias-com-area-de-6872-ha-r-53960000-cod-8vltum/8VLTUM
TJV9Q2,Chácara em Heitoraí - Goiás,Chácara,2500000,R$ 2.500.000,,48400,1,Heitoraí,Goiás,-15.718986,-49.826825,"2 Poultry Barns (125m x 12m each); 2 Metaza heaters; 1 Metaza dehydrator; 1 MWM 150 KVA generator; 6 new line motors; 2 silo motors; 2 artesian wells; 2 x 20,000-liter water reservoirs; 1 main house; 1 farmworker house; Fenced property with electric fence; Solar power system (98 panels, 7,500 KVA monthly capacity)","Excelente oportunidade de negócio with fully documented property. Poultry farming operation with current contract SSA São Salvador Alimentos.",,,,https://chaozao.com.br/imovel/chacara-em-heitorai-goias-com-area-de-48400-m-r-2500000-cod-tjv9q2/TJV9Q2